{
  "$schema": "https://json-schema.org/draft/2020-12/schema",
  "$id": "https://pokerapp.local/contracts/action.schema.json",
  "title": "Action",
  "version": "1.6",
  "description": "ActionRecord.to_dict() の契約（hand core, ADR-0010 R5）。ISSUE-0011 の決定により additionalProperties:true で 1.0（false 昇格は後続、範囲膨張防止）。ADR-0009 の推定 additive フィールドは optional。1.1 = street の意味を明文化（description のみ / validation 不変, ISSUE-0029）。1.2 = position を optional 追加（ディーラーボタン回転で解決する席のポジション名。ISSUE-0032, additive）。1.3 (ADR-0047 G2, additive) = reason / apply_ok を追加し、監査フィールド一式（actor_source / corrected_from / reason / asr_confidence / apply_ok）を rules-aware 経路が実際に emit する（verify-v1 系列では 1.1 だったものを 2026-09-22 のマージで統合）。actor_source に \"spoken_position\" を追加（ポジション名の読み上げ）。\"rfid\" は旧記録にのみ現れる（RFID の検出は actor の証拠にしない, ISSUE-0033 / ADR-0056）。1.4 (ADR-0060, additive) = raw_text（そのアクションになった発話の書き起こし / CLI で打った読み上げ文。合成 fold と legacy 経路には無い）を optional 追加。1.5 (ADR-0062, additive) = action に \"end_hand\"（「ハンド終了」。状態に適用できなかった制御語の保留レコードにだけ現れる）を追加。ショーダウンで見せずにマックした記録は action=fold / street=\"showdown\" / reason に showdown_muck（アウトオブポジションから順とみなした 3 人以上のときは muck_order_assumed、手札で見るとマックした側が強かったときは mucked_stronger_hand）。1.6 (2026-10-24, additive) = 持ち点を数えないモードのハンド（hand の stackless）では stack_after が null、オールインとそれに向き合ったコールの amount が null、そのハンドの最初のオールインからの pot_after が null。",
  "type": "object",
  "additionalProperties": true,
  "required": [
    "hand_id", "timestamp", "street", "seat", "player_name", "action", "amount",
    "pot_after", "stack_after", "source", "needs_review", "confidence"
  ],
  "properties": {
    "hand_id": {"type": "integer", "minimum": 0},
    "timestamp": {"type": "string", "description": "ISO 8601。event.timestamp 由来（ADR-0048 T3: live と replay で同義）。合成 silent-fold は RFID の不在観測時刻を優先する（ADR-0055）。"},
    "street": {
      "type": "string",
      "description": "そのアクションが**行われた**ストリート（適用後ではない）。rules-aware backend はラウンドを閉じるアクションで次ストリートへ自動進行するため、記録は適用前の値を採る（ISSUE-0029）。"
    },
    "seat": {"type": "integer", "minimum": 1, "maximum": 9},
    "player_name": {"type": "string"},
    "action": {"enum": ["bet", "call", "raise", "check", "fold", "allin", "showdown", "winner", "new_hand", "end_hand"]},
    "amount": {"type": ["integer", "null"], "minimum": 0, "description": "null = 持ち点を数えないモードのオールイン・それに向き合ったコール（1.6）"},
    "pot_after": {"type": ["integer", "null"], "minimum": 0},
    "stack_after": {"type": ["integer", "null"], "minimum": 0},
    "source": {
      "type": "object",
      "properties": {
        "camera": {"type": "boolean"},
        "audio": {"type": "boolean"},
        "rfid": {"type": "boolean"}
      }
    },
    "needs_review": {"type": "boolean"},
    "confidence": {"type": "number", "minimum": 0, "maximum": 1},
    "position": {
      "type": "string",
      "enum": ["BTN", "SB", "BB", "UTG", "UTG+1", "UTG+2", "MP", "HJ", "CO", ""],
      "description": "そのアクションを行った席の**ポジション名**（仕様 §6.2）。ボタン席から導出（`core/positions.py`）。ボタンを持たない backend（legacy）では空文字（ISSUE-0032, additive）。"
    },
    "legal_actions": {"type": "array", "items": {"type": "string"}},
    "amount_to_call": {"type": "integer", "minimum": 0},
    "corrected_from": {"type": ["string", "null"], "description": "修復前の生 ASR action"},
    "actor_source": {"type": ["string", "null"], "description": "actor 推定の根拠: rfid | spoken_seat | engine_prior | unresolved"},
    "asr_confidence": {"type": ["number", "null"], "minimum": 0, "maximum": 1},
    "reason": {"type": "string", "description": "射影/合成/競合の監査理由（複数は '+' 区切り, ADR-A G2）"},
    "apply_ok": {"type": "boolean", "description": "pokerkit が受理したか（false = state 非反映のレコード, ADR-A G2）"},
    "raw_text": {"type": "string", "description": "そのアクションになった発話（Whisper の書き起こし、または CLI で打った読み上げ文）。合成した fold には無い（ADR-0060, additive）"}
  }
}
