{
  "hand_id": 1,
  "timestamp": "2026-06-05T04:00:00.000",
  "street": "preflop",
  "seat": 3,
  "player_name": "P3",
  "action": "call",
  "amount": 200,
  "pot_after": 500,
  "stack_after": 9800,
  "source": {"camera": false, "audio": true, "rfid": true},
  "needs_review": true,
  "confidence": 0.888
}
